{
  "batting": {
    "batters": [
      {
        "batterId": "draft:lahman:raleica01",
        "stats": {
          "atBats": 716,
          "doubles": 22,
          "fieldersChoices": 14,
          "groundedIntoDoublePlays": 6,
          "hitByPitch": 13,
          "hits": 152,
          "homeRuns": 35,
          "intentionalWalks": 0,
          "plateAppearances": 800,
          "reachedOnError": 4,
          "runs": 98,
          "runsBattedIn": 102,
          "singles": 95,
          "strikeouts": 249,
          "triples": 0,
          "walks": 71
        }
      },
      {
        "batterId": "draft:lahman:goldspa01",
        "stats": {
          "atBats": 710,
          "doubles": 39,
          "fieldersChoices": 9,
          "groundedIntoDoublePlays": 15,
          "hitByPitch": 5,
          "hits": 179,
          "homeRuns": 32,
          "intentionalWalks": 0,
          "plateAppearances": 775,
          "reachedOnError": 5,
          "runs": 104,
          "runsBattedIn": 88,
          "singles": 107,
          "strikeouts": 205,
          "triples": 1,
          "walks": 60
        }
      },
      {
        "batterId": "draft:lahman:gimenan01",
        "stats": {
          "atBats": 699,
          "doubles": 21,
          "fieldersChoices": 20,
          "groundedIntoDoublePlays": 15,
          "hitByPitch": 22,
          "hits": 173,
          "homeRuns": 10,
          "intentionalWalks": 0,
          "plateAppearances": 758,
          "reachedOnError": 6,
          "runs": 89,
          "runsBattedIn": 59,
          "singles": 139,
          "strikeouts": 119,
          "triples": 3,
          "walks": 37
        }
      },
      {
        "batterId": "draft:lahman:chapmma01",
        "stats": {
          "atBats": 661,
          "doubles": 40,
          "fieldersChoices": 18,
          "groundedIntoDoublePlays": 13,
          "hitByPitch": 8,
          "hits": 163,
          "homeRuns": 34,
          "intentionalWalks": 0,
          "plateAppearances": 741,
          "reachedOnError": 4,
          "runs": 104,
          "runsBattedIn": 111,
          "singles": 89,
          "strikeouts": 174,
          "triples": 0,
          "walks": 72
        }
      },
      {
        "batterId": "draft:lahman:wittbo02",
        "stats": {
          "atBats": 665,
          "doubles": 43,
          "fieldersChoices": 15,
          "groundedIntoDoublePlays": 14,
          "hitByPitch": 9,
          "hits": 226,
          "homeRuns": 32,
          "intentionalWalks": 0,
          "plateAppearances": 726,
          "reachedOnError": 3,
          "runs": 126,
          "runsBattedIn": 128,
          "singles": 141,
          "strikeouts": 140,
          "triples": 10,
          "walks": 52
        }
      },
      {
        "batterId": "draft:lahman:kwanst01",
        "stats": {
          "atBats": 643,
          "doubles": 25,
          "fieldersChoices": 15,
          "groundedIntoDoublePlays": 17,
          "hitByPitch": 7,
          "hits": 174,
          "homeRuns": 17,
          "intentionalWalks": 0,
          "plateAppearances": 714,
          "reachedOnError": 4,
          "runs": 102,
          "runsBattedIn": 72,
          "singles": 128,
          "strikeouts": 95,
          "triples": 4,
          "walks": 64
        }
      },
      {
        "batterId": "draft:lahman:judgeaa01",
        "stats": {
          "atBats": 584,
          "doubles": 29,
          "fieldersChoices": 9,
          "groundedIntoDoublePlays": 9,
          "hitByPitch": 8,
          "hits": 176,
          "homeRuns": 65,
          "intentionalWalks": 0,
          "plateAppearances": 695,
          "reachedOnError": 1,
          "runs": 147,
          "runsBattedIn": 156,
          "singles": 80,
          "strikeouts": 185,
          "triples": 2,
          "walks": 103
        }
      },
      {
        "batterId": "draft:lahman:sotoju01",
        "stats": {
          "atBats": 557,
          "doubles": 32,
          "fieldersChoices": 12,
          "groundedIntoDoublePlays": 13,
          "hitByPitch": 8,
          "hits": 152,
          "homeRuns": 32,
          "intentionalWalks": 0,
          "plateAppearances": 675,
          "reachedOnError": 2,
          "runs": 106,
          "runsBattedIn": 109,
          "singles": 83,
          "strikeouts": 123,
          "triples": 5,
          "walks": 110
        }
      },
      {
        "batterId": "draft:lahman:ohtansh01",
        "stats": {
          "atBats": 576,
          "doubles": 39,
          "fieldersChoices": 14,
          "groundedIntoDoublePlays": 12,
          "hitByPitch": 3,
          "hits": 166,
          "homeRuns": 43,
          "intentionalWalks": 0,
          "plateAppearances": 663,
          "runs": 97,
          "runsBattedIn": 141,
          "singles": 83,
          "strikeouts": 150,
          "triples": 1,
          "walks": 84
        }
      }
    ],
    "schemaVersion": "1.0.0",
    "teamId": "defense-pilot-2024",
    "totals": {
      "atBats": 5811,
      "doubles": 290,
      "fieldersChoices": 126,
      "groundedIntoDoublePlays": 114,
      "hitByPitch": 83,
      "hits": 1561,
      "homeRuns": 300,
      "intentionalWalks": 0,
      "plateAppearances": 6547,
      "reachedOnError": 29,
      "runs": 973,
      "runsBattedIn": 966,
      "singles": 945,
      "strikeouts": 1440,
      "triples": 26,
      "walks": 653
    }
  },
  "dashboard": {
    "defenseModelId": null,
    "games": [
      {
        "gameNumber": 1,
        "hits": [3, 22],
        "homeRuns": [0, 7],
        "innings": 9,
        "leftOnBase": [5, 7],
        "lineScore": [
          [0, 0],
          [0, 1],
          [0, 2],
          [1, 4],
          [0, 11],
          [0, 1],
          [0, 4],
          [0, 0],
          [0, null]
        ],
        "losses": 1,
        "opponentId": "representative:2024:ARI",
        "plateAppearances": 87,
        "score": [1, 23],
        "seed": "10346940957598392952",
        "strikeouts": [7, 7],
        "userHome": false,
        "walks": [3, 7],
        "wins": 0,
        "won": false
      },
      {
        "gameNumber": 2,
        "hits": [4, 10],
        "homeRuns": [0, 0],
        "innings": 9,
        "leftOnBase": [5, 10],
        "lineScore": [
          [0, 1],
          [0, 0],
          [0, 0],
          [0, 0],
          [0, 2],
          [0, 0],
          [0, 0],
          [0, 1],
          [1, 0]
        ],
        "losses": 2,
        "opponentId": "representative:2024:ARI",
        "plateAppearances": 74,
        "score": [1, 4],
        "seed": "10284689419445729823",
        "strikeouts": [8, 11],
        "userHome": true,
        "walks": [3, 5],
        "wins": 0,
        "won": false
      },
      {
        "gameNumber": 3,
        "hits": [11, 14],
        "homeRuns": [2, 1],
        "innings": 11,
        "leftOnBase": [11, 7],
        "lineScore": [
          [0, 0],
          [1, 0],
          [0, 1],
          [2, 0],
          [0, 2],
          [0, 1],
          [0, 0],
          [1, 0],
          [0, 0],
          [0, 0],
          [3, 4]
        ],
        "losses": 3,
        "opponentId": "representative:2024:BAL",
        "plateAppearances": 98,
        "score": [7, 8],
        "seed": "13994868318467958865",
        "strikeouts": [13, 9],
        "userHome": false,
        "walks": [6, 2],
        "wins": 0,
        "won": false
      },
      {
        "gameNumber": 4,
        "hits": [4, 5],
        "homeRuns": [1, 1],
        "innings": 10,
        "leftOnBase": [6, 5],
        "lineScore": [
          [0, 0],
          [0, 0],
          [0, 0],
          [0, 0],
          [0, 0],
          [0, 0],
          [0, 0],
          [1, 1],
          [0, 0],
          [1, 0]
        ],
        "losses": 3,
        "opponentId": "representative:2024:BAL",
        "plateAppearances": 73,
        "score": [2, 1],
        "seed": "7588867838358303006",
        "strikeouts": [12, 8],
        "userHome": true,
        "walks": [4, 2],
        "wins": 1,
        "won": true
      },
      {
        "gameNumber": 5,
        "hits": [20, 9],
        "homeRuns": [7, 0],
        "innings": 9,
        "leftOnBase": [13, 11],
        "lineScore": [
          [0, 0],
          [0, 0],
          [0, 0],
          [9, 0],
          [1, 0],
          [2, 1],
          [2, 0],
          [0, 0],
          [1, 0]
        ],
        "losses": 3,
        "opponentId": "representative:2024:BOS",
        "plateAppearances": 94,
        "score": [15, 1],
        "seed": "13459906181933907157",
        "strikeouts": [10, 12],
        "userHome": false,
        "walks": [5, 2],
        "wins": 2,
        "won": true
      },
      {
        "gameNumber": 6,
        "hits": [17, 13],
        "homeRuns": [7, 2],
        "innings": 9,
        "leftOnBase": [10, 8],
        "lineScore": [
          [0, 0],
          [2, 0],
          [0, 1],
          [6, 0],
          [2, 2],
          [2, 0],
          [1, 1],
          [1, 0],
          [null, 2]
        ],
        "losses": 3,
        "opponentId": "representative:2024:BOS",
        "plateAppearances": 89,
        "score": [14, 6],
        "seed": "10691892703261836916",
        "strikeouts": [8, 7],
        "userHome": true,
        "walks": [8, 1],
        "wins": 3,
        "won": true
      },
      {
        "gameNumber": 7,
        "hits": [17, 6],
        "homeRuns": [4, 1],
        "innings": 9,
        "leftOnBase": [11, 4],
        "lineScore": [
          [0, 0],
          [4, 0],
          [1, 0],
          [5, 0],
          [0, 0],
          [0, 0],
          [1, 0],
          [1, 0],
          [0, 2]
        ],
        "losses": 3,
        "opponentId": "representative:2024:CHA",
        "plateAppearances": 83,
        "score": [12, 2],
        "seed": "15496767980479141050",
        "strikeouts": [6, 10],
        "userHome": false,
        "walks": [5, 0],
        "wins": 4,
        "won": true
      },
      {
        "gameNumber": 8,